Ticker,Title,Summary,URL,Original Published Time,Datetime,News Age (Days),News Time,Current Price,1 Hour Ago,4 Hours Ago,Previous Day Close,7 Days Ago,1 Hour Ago % Change,4 Hours Ago % Change,Previous Day Close % Change,7 Days Ago % Change,Headline Sentiment,Summary Sentiment
CDW,Why CDW (CDW) is a Top Value Stock for the Long-Term,The Zacks Style Scores offers investors a way to easily find top-rated stocks based on their investing style. Here's why you should take advantage.,https://finance.yahoo.com/news/why-cdw-cdw-top-value-134002215.html?.tsrc=rss,"Fri, 27 Jun 2025 13:40:02 +0000",2025-06-27 09:40:02-04:00,9,2025-06-27 09:40:02-04:00,178.64,178.64,178.64,177.46,171.22,0.0,0.0,0.66,4.33,0.5,0.53
CDW,3 of Wall Street’s Favorite Stocks with Mounting Challenges,"The stocks in this article have caught Wall Street’s attention in a big way, with price targets implying returns above 20%. But investors should take these forecasts with a grain of salt because analysts typically say nice things about companies so their firms can win business in other product lines like M&amp;A advisory.",https://finance.yahoo.com/news/3-wall-street-favorite-stocks-044226055.html?.tsrc=rss,"Mon, 16 Jun 2025 04:42:26 +0000",2025-06-16 00:42:26-04:00,20,2025-06-16 00:42:26-04:00,173.01,N/A,N/A,N/A,178.11,N/A,N/A,N/A,-2.86,0.5,0.92
CHD,L’Oréal Acquires Color Wow,The hair care brand started by serial entrepreneur Gail Federici will live in the Professional Products Division.,https://wwd.com/beauty-industry-news/hair/loreal-acquires-hair-care-brand-color-wow-1237961652/?.tsrc=rss,"Mon, 30 Jun 2025 16:15:00 +0000",2025-06-30 12:15:00-04:00,5,2025-06-30 12:15:00-04:00,95.85,95.68,95.52,N/A,96.43,0.18,0.35,N/A,-0.6,0.1,0.49
CHD,Is Procter & Gamble Set to Shield Earnings From Global Volatility?,"PG leans on pricing, cost efficiency, productivity and brand strength to protect margins as global volatility clouds earnings outlook.",https://finance.yahoo.com/news/procter-gamble-set-shield-earnings-150800571.html?.tsrc=rss,"Mon, 30 Jun 2025 15:08:00 +0000",2025-06-30 11:08:00-04:00,5,2025-06-30 11:08:00-04:00,95.68,95.78,95.52,N/A,96.25,-0.1,0.17,N/A,-0.59,0.0,0.81
CHD,2 Consumer Stocks to Consider Right Now and 1 to Turn Down,"Consumer staples stocks are solid insurance policies in frothy markets ripe for corrections. But they’re also double-edged swords as they often lag in booming conditions, and this pattern has persisted recently. Over the past six months, the industry has recorded a loss of 10.5%, a far cry from the S&amp;P 500’s 4.5% ascent.",https://finance.yahoo.com/news/2-consumer-stocks-consider-now-043111941.html?.tsrc=rss,"Mon, 30 Jun 2025 04:31:11 +0000",2025-06-30 00:31:11-04:00,6,2025-06-30 00:31:11-04:00,95.52,N/A,N/A,N/A,96.54,N/A,N/A,N/A,-1.06,0.07,-0.87
CI,Robinhood Stock Is Falling After S&P 500 Snub. Why That’s Shortsighted.,"Robinhood Markets  had a market valuation of nearly $86.5 billion as of Wednesday’s stock market close.  Shares of  Datadog  soared nearly 15% Thursday morning on the news, while Robinhood’s stock fell about 5%.",https://finance.yahoo.com/m/56803c4f-ee04-3c73-b855-0dafc4737b8b/robinhood-stock-is-falling.html?.tsrc=rss,"Thu, 03 Jul 2025 15:19:00 +0000",2025-07-03 11:19:00-04:00,2,2025-07-03 11:19:00-04:00,318.9,319.29,319.76,325.16,331.29,-0.12,-0.27,-1.93,-3.74,0.0,0.3
CI,Stocks Supported by Chip Stock Strength and Trade News,"The S&amp;P 500 Index ($SPX ) (SPY ) today is up +0.25%, the Dow Jones Industrials Index ($DOWI ) (DIA ) is down -0.10%, and the Nasdaq 100 Index ($IUXX ) (QQQ ) is up +0.67%. September E-mini S&amp;P futures (ESU25 ) are up +0.18%, and September E-mini Nasdaq futures...",https://www.barchart.com/story/news/33177486/stocks-supported-by-chip-stock-strength-and-trade-news?.tsrc=rss,"Wed, 02 Jul 2025 15:26:19 +0000",2025-07-02 11:26:19-04:00,3,2025-07-02 11:26:19-04:00,325.16,325.8,323.93,335.9,314.85,-0.2,0.38,-3.2,3.27,0.0,0.0
CI,AM Best Removes From Under Review With Developing Implications and Affirms Credit Ratings of Certain Members of Health Care Service Corp Medicare & Supplemental Group Members,"OLDWICK, N.J., July 01, 2025--AM Best has removed from under review with developing implications and affirmed the Financial Strength Rating (FSR) of A (Excellent) and the Long-Term Issuer Credit Ratings (Long-Term ICR) of ""a"" (Excellent) of select members of Health Care Service Corp Medicare & Supplemental Group (HCSC Medicare & Supplemental Group) (Chicago, IL). At the same time, AM Best has removed from under review with developing implications and downgraded the Long-Term ICRs to ""a"" (Excelle",https://finance.yahoo.com/news/am-best-removes-under-review-214900091.html?.tsrc=rss,"Tue, 01 Jul 2025 21:49:00 +0000",2025-07-01 17:49:00-04:00,4,2025-07-01 17:49:00-04:00,334.34,334.34,335.16,330.5,316.87,0.0,-0.24,1.16,5.51,0.61,0.95
CINF,Are Cincinnati Financial Corporation's (NASDAQ:CINF) Fundamentals Good Enough to Warrant Buying Given The Stock's Recent Weakness?,"It is hard to get excited after looking at Cincinnati Financial's (NASDAQ:CINF) recent performance, when its stock has...",https://finance.yahoo.com/news/cincinnati-financial-corporations-nasdaq-cinf-130243106.html?.tsrc=rss,"Mon, 30 Jun 2025 13:02:43 +0000",2025-06-30 09:02:43-04:00,6,2025-06-30 09:02:43-04:00,146.31,146.31,146.31,N/A,145.37,0.0,0.0,N/A,0.65,0.17,0.25
CINF,2 Reasons to Watch CINF and 1 to Stay Cautious,"Cincinnati Financial currently trades at $146.26 per share and has shown little upside over the past six months, posting a middling return of 2.2%.",https://finance.yahoo.com/news/2-reasons-watch-cinf-1-040342769.html?.tsrc=rss,"Mon, 30 Jun 2025 04:03:42 +0000",2025-06-30 00:03:42-04:00,6,2025-06-30 00:03:42-04:00,146.31,N/A,N/A,N/A,145.37,N/A,N/A,N/A,0.65,0.0,0.3
CINF,SIGI Stock Trading at a Premium to Industry: How to Play the Stock,"Selective Insurance stock remains poised to gain from solid retention rates, higher new business gains and renewal pure price increases.",https://finance.yahoo.com/news/sigi-stock-trading-premium-industry-132000915.html?.tsrc=rss,"Tue, 24 Jun 2025 13:20:00 +0000",2025-06-24 09:20:00-04:00,12,2025-06-24 09:20:00-04:00,147.27,147.27,147.27,145.37,145.44,0.0,0.0,1.31,1.26,0.0,0.81
CTAS,Cintas Corporation Announces Webcast for Fourth Quarter Fiscal Year 2025 Results,"CINCINNATI, July 03, 2025--Cintas Corporation (Nasdaq: CTAS) today announced that it will release fiscal year 2025 fourth quarter and full year results on Thursday, July 17, 2025. The Company will conduct a conference call to address the financial results. A live webcast of the call will be available to individual investors and the public beginning at 10:00 a.m., Eastern Time, on Thursday, July 17, 2025.",https://finance.yahoo.com/news/cintas-corporation-announces-webcast-fourth-145200480.html?.tsrc=rss,"Thu, 03 Jul 2025 14:52:00 +0000",2025-07-03 10:52:00-04:00,2,2025-07-03 10:52:00-04:00,218.93,217.51,217.51,216.25,219.79,0.65,0.65,1.24,-0.39,0.0,0.0
CTAS,3 Reasons Why Cintas (CTAS) Is a Great Growth Stock,"Cintas (CTAS) possesses solid growth attributes, which could help it handily outperform the market.",https://finance.yahoo.com/news/3-reasons-why-cintas-ctas-164502739.html?.tsrc=rss,"Wed, 02 Jul 2025 16:45:02 +0000",2025-07-02 12:45:02-04:00,3,2025-07-02 12:45:02-04:00,217.03,215.99,220.23,224.02,219.24,0.48,-1.45,-3.12,-1.01,0.8,0.71
CTAS,"Nike upgraded, Sportradar initiated: Wall Street’s top analyst calls","The most talked about and market moving research calls around Wall Street are now in one place. Here are today’s research calls that investors need to know, as compiled by The Fly. Top 5 Upgrades: Argus upgraded Nike (NKE) to Buy from Hold with an $85 price target. The recovery in Nike’s stock is underway as the company is utilizing the e-commerce channel to improve pricing, the firm tells investors in a research note. Raymond James upgraded Hyatt (H) to Strong Buy from Market Perform with a $16",https://finance.yahoo.com/news/nike-upgraded-sportradar-initiated-wall-133606461.html?.tsrc=rss,"Wed, 02 Jul 2025 13:36:06 +0000",2025-07-02 09:36:06-04:00,4,2025-07-02 09:36:06-04:00,220.23,220.23,220.23,223.85,220.82,0.0,0.0,-1.62,-0.27,0.5,0.79
CSX,5 Must-Read Analyst Questions From CSX’s Q1 Earnings Call,"CSX’s first quarter results fell short of Wall Street’s expectations, with management citing a combination of operational disruptions and external headwinds as primary factors. CEO Joseph R. Hinrichs stated, “Our performance fell short of our expectations. As a result, we left good business on the table, reduced our revenues, and our inefficiencies meant we incurred more expense.” The company faced network slowdowns due to two major infrastructure projects—Howard Street Tunnel and Blue Ridge sub",https://finance.yahoo.com/news/5-must-read-analyst-questions-054225218.html?.tsrc=rss,"Thu, 03 Jul 2025 05:42:25 +0000",2025-07-03 01:42:25-04:00,3,2025-07-03 01:42:25-04:00,33.58,33.58,33.61,33.38,32.65,0.0,-0.09,0.6,2.85,0.0,0.13
CSX,CSX's (NASDAQ:CSX) 9.4% CAGR outpaced the company's earnings growth over the same five-year period,"The main point of investing for the long term is to make money. Better yet, you'd like to see the share price move up...",https://finance.yahoo.com/news/csxs-nasdaq-csx-9-4-130027611.html?.tsrc=rss,"Wed, 02 Jul 2025 13:00:27 +0000",2025-07-02 09:00:27-04:00,4,2025-07-02 09:00:27-04:00,33.38,33.38,33.38,33.1,32.23,0.0,0.0,0.85,3.57,0.0,0.77
CTSH,3 IT Services Stocks to Buy Right Now From a Prospering Industry,"The Zacks Computers - IT Services Industry participants like INFY, CTSH and TBLA are benefiting from ongoing digitization, strong demand for hybrid working solutions and improving IT spending.",https://finance.yahoo.com/news/3-services-stocks-buy-now-161700378.html?.tsrc=rss,"Thu, 03 Jul 2025 16:17:00 +0000",2025-07-03 12:17:00-04:00,2,2025-07-03 12:17:00-04:00,81.13,81.13,81.16,79.94,77.52,0.0,-0.04,1.49,4.66,0.29,0.83
CLX,The Top 5 Analyst Questions From Clorox’s Q1 Earnings Call,"Clorox’s first quarter results fell short of Wall Street’s expectations, with revenue and adjusted earnings per share both missing consensus forecasts. The market responded negatively, reflecting concerns around the company’s top-line performance. CEO Linda Rendle attributed the underperformance to a combination of weakening U.S. consumer sentiment, increased macroeconomic uncertainty, and shifting consumer spending patterns late in the quarter. She noted that while Clorox’s core categories are",https://finance.yahoo.com/news/top-5-analyst-questions-clorox-215508935.html?.tsrc=rss,"Thu, 26 Jun 2025 21:55:08 +0000",2025-06-26 17:55:08-04:00,9,2025-06-26 17:55:08-04:00,118.0,118.0,118.09,119.49,N/A,0.0,-0.08,-1.25,N/A,0.5,-0.38
CNC,Centene (NYSE:CNC) Withdraws Full-Year Outlook Due To Enrollment Challenges,"Centene (NYSE:CNC) faced significant challenges last week, as its share price dropped by 37%, despite its inclusion in the Russell 1000 Defensive and Value-Defensive Indices on June 28, 2025. This index addition underscored the company's recognition for performance and stability. However, the severe price decline was largely driven by Centene's decision to withdraw its full-year outlook due to unexpected enrollment data and rising member health costs. This negative move starkly contrasted...",https://finance.yahoo.com/news/centene-nyse-cnc-withdraws-full-171706025.html?.tsrc=rss,"Thu, 03 Jul 2025 17:17:06 +0000",2025-07-03 13:17:06-04:00,2,2025-07-03 13:17:06-04:00,33.53,33.53,34.29,34.38,53.46,0.0,-2.22,-2.47,-37.28,-0.12,-0.44
CNP,Southern Company's Georgia Power Freezes Base Rates Through 2028,"SO's Georgia Power is set to provide stable base rates to customers through 2028, as the Georgia PSC approved a plan supporting affordable energy across the state.",https://finance.yahoo.com/news/southern-companys-georgia-power-freezes-120400430.html?.tsrc=rss,"Thu, 03 Jul 2025 12:04:00 +0000",2025-07-03 08:04:00-04:00,3,2025-07-03 08:04:00-04:00,35.88,35.88,35.88,36.24,36.31,0.0,0.0,-0.99,-1.18,-0.4,0.84
CNP,CenterPoint Energy (CNP) Could Be a Great Choice,"Dividends are one of the best benefits to being a shareholder, but finding a great dividend stock is no easy task. Does CenterPoint Energy (CNP) have what it takes? Let's find out.",https://finance.yahoo.com/news/centerpoint-energy-cnp-could-great-154511092.html?.tsrc=rss,"Wed, 02 Jul 2025 15:45:11 +0000",2025-07-02 11:45:11-04:00,3,2025-07-02 11:45:11-04:00,35.76,35.79,36.24,36.44,36.31,-0.08,-1.32,-1.87,-1.51,0.8,0.93
CNP,"Power Demand For Data Centers, AI Fuels 870% Rally For Quanta Services","Quanta Services pushes to record highs as power demand for AI, data centers fuels massive rally. Analysts see more growth.",https://finance.yahoo.com/m/0853be6e-98bd-3a07-8f94-37e9c3aac3e5/power-demand-for-data.html?.tsrc=rss,"Fri, 27 Jun 2025 20:23:54 +0000",2025-06-27 16:23:54-04:00,8,2025-06-27 16:23:54-04:00,36.36,36.36,36.6,36.6,35.73,0.0,-0.66,-0.66,1.76,0.0,0.34
CTRA,Oil Stocks Could Damage Your Portfolio in July,"There are six oil, gas, and coal names that typically underperform in July",https://finance.yahoo.com/news/oil-stocks-could-damage-portfolio-151314327.html?.tsrc=rss,"Thu, 03 Jul 2025 15:13:14 +0000",2025-07-03 11:13:14-04:00,2,2025-07-03 11:13:14-04:00,25.17,25.09,25.16,24.84,26.01,0.32,0.04,1.33,-3.23,0.0,0.0
CTRA,"Nike upgraded, Sportradar initiated: Wall Street’s top analyst calls","The most talked about and market moving research calls around Wall Street are now in one place. Here are today’s research calls that investors need to know, as compiled by The Fly. Top 5 Upgrades: Argus upgraded Nike (NKE) to Buy from Hold with an $85 price target. The recovery in Nike’s stock is underway as the company is utilizing the e-commerce channel to improve pricing, the firm tells investors in a research note. Raymond James upgraded Hyatt (H) to Strong Buy from Market Perform with a $16",https://finance.yahoo.com/news/nike-upgraded-sportradar-initiated-wall-133606461.html?.tsrc=rss,"Wed, 02 Jul 2025 13:36:06 +0000",2025-07-02 09:36:06-04:00,4,2025-07-02 09:36:06-04:00,24.73,24.73,24.73,24.83,26.34,0.0,0.0,-0.4,-6.11,0.5,0.79
CTVA,"Agricultural Biotechnology Market Outlook Report to 2030, with Profiles of Bayer, Corteva, Syngenta, BASF, FMC, Bioceres Crop Solutions, Evogene, Marrone Bio Innovations, Calyxt & Arcadia Biosciences","The agricultural biotechnology market presents opportunities in gene editing, precision breeding, and AI integration, driven by demand for climate-resilient, sustainable solutions. Regional innovation and strategic alliances are key, with expanding applications in pharma, biofuels, and industry enhancing growth potential. Agricultural Biotechnology Market Agricultural Biotechnology Market Dublin, July 03, 2025 (GLOBE NEWSWIRE) -- The ""Agricultural Biotechnology Market by Crop Type, Trait Type, A",https://finance.yahoo.com/news/agricultural-biotechnology-market-outlook-report-152200850.html?.tsrc=rss,"Thu, 03 Jul 2025 15:22:00 +0000",2025-07-03 11:22:00-04:00,2,2025-07-03 11:22:00-04:00,76.98,77.08,77.02,76.39,74.72,-0.13,-0.05,0.77,3.02,0.0,0.79
CTVA,4 Agriculture Operations Stocks Riding Health Trends Amid Margin Woes,"The Agriculture - Operations industry is gaining from healthy eating trends, innovation and global demand, but rising costs and trade risks pose challenges. CTVA, ADM, AVO and ALCO look promising.",https://finance.yahoo.com/news/4-agriculture-operations-stocks-riding-131200965.html?.tsrc=rss,"Thu, 03 Jul 2025 13:12:00 +0000",2025-07-03 09:12:00-04:00,3,2025-07-03 09:12:00-04:00,77.02,77.02,77.02,75.9,74.56,0.0,0.0,1.48,3.3,0.0,0.69
CTVA,Constellation Brands Pre-Q1 Earnings: Are Trends Pointing to a Beat?,STZ is set to report Q1 results with expected drops in earnings and sales despite beer segment strength and premium gains.,https://finance.yahoo.com/news/constellation-brands-pre-q1-earnings-145900830.html?.tsrc=rss,"Mon, 30 Jun 2025 14:59:00 +0000",2025-06-30 10:59:00-04:00,5,2025-06-30 10:59:00-04:00,74.46,74.38,74.38,N/A,74.74,0.11,0.11,N/A,-0.37,0.0,-0.06
COTY,Decline in Cosmetic Sales Affected Coty (COTY) in Q1,"Hardman Johnston Global Advisors, an investment management company, released its “Hardman Johnston Global Equity Strategy” first quarter 2025 investor letter. A copy of the letter can be downloaded here. The strategy returned 0.43%, net of fees, in the quarter compared to -1.32% for the MSCI AC World Net Index. The Portfolio experienced a solid quarter […]",https://finance.yahoo.com/news/decline-cosmetic-sales-affected-coty-113322087.html?.tsrc=rss,"Tue, 01 Jul 2025 11:33:22 +0000",2025-07-01 07:33:22-04:00,5,2025-07-01 07:33:22-04:00,4.86,4.86,4.86,4.64,4.81,0.0,0.0,4.74,1.04,0.0,0.15
COTY,5 Must-Read Analyst Questions From Coty’s Q1 Earnings Call,"Coty’s first quarter performance drew a negative market reaction, with management highlighting a difficult mix of internal and external factors. CEO Sue Nabi cited ongoing weakness in the Consumer Beauty division, particularly in Color Cosmetics, as well as inventory tightening by retailers—especially in the U.S.—as key contributors to the company’s underperformance. In addition, Prestige cosmetics faced pressure from Asian markets and Chinese travel retail, while the company actively worked to",https://finance.yahoo.com/news/5-must-read-analyst-questions-093821064.html?.tsrc=rss,"Fri, 27 Jun 2025 09:38:21 +0000",2025-06-27 05:38:21-04:00,9,2025-06-27 05:38:21-04:00,4.61,4.61,4.61,4.66,4.78,0.0,0.0,-1.07,-3.56,0.0,-0.46
COTY,Coty Reportedly Weighs Strategic Split of Luxury and Consumer Divisions,"Coty Inc. (NYSE:COTY) is one of the 10 best-value penny stocks to buy, according to analysts. On June 16, WWD (Women’s Wear Daily) reported that Coty (NYSE:COTY) is exploring a potential sale, possibly splitting its business into two parts—luxury and consumer. Sources suggest the move is in early discussion stages, with no formal statement from […]",https://finance.yahoo.com/news/coty-reportedly-weighs-strategic-split-081716235.html?.tsrc=rss,"Fri, 27 Jun 2025 08:17:16 +0000",2025-06-27 04:17:16-04:00,9,2025-06-27 04:17:16-04:00,4.61,4.61,4.61,4.66,4.78,0.0,0.0,-1.07,-3.56,0.0,-0.3
CPB,Why Is Campbell (CPB) Down 7.5% Since Last Earnings Report?,Campbell (CPB) reported earnings 30 days ago. What's next for the stock? We take a look at earnings estimates for some clues.,https://finance.yahoo.com/news/why-campbell-cpb-down-7-153003032.html?.tsrc=rss,"Wed, 02 Jul 2025 15:30:03 +0000",2025-07-02 11:30:03-04:00,3,2025-07-02 11:30:03-04:00,31.81,31.94,31.55,32.17,31.51,-0.41,0.82,-1.12,0.95,-0.08,0.0
CPB,Top stock picks in the snack aisle: Impact of GLP-1s & RFK Jr.,"Bank of America Securities food and beverage analyst Peter Galbo joins Market Domination to discuss how to navigate snack food stocks. To watch more expert insights and analysis on the latest market action, check out more Market Domination Overtime here.",https://finance.yahoo.com/video/top-stock-picks-snack-aisle-205452070.html?.tsrc=rss,"Tue, 01 Jul 2025 20:54:52 +0000",2025-07-01 16:54:52-04:00,4,2025-07-01 16:54:52-04:00,31.69,31.69,31.78,30.65,32.15,0.0,-0.28,3.39,-1.43,0.5,0.2
CPB,The Battle to Keep Consumers Means Smaller Packs of Cookies and Chips,"Consumer goods companies are enlarging their range of products—by making them smaller.  Diminutive snack and drink sizes are hitting store shelves as brands try to keep stretched consumers buying with lower-price options.  PepsiCo  now sells Lay’s potato chips in half a dozen different-sized bags, costing from around 50 cents to roughly $5.",https://finance.yahoo.com/m/3fcab2ba-4987-3db2-92f5-5881406758c7/the-battle-to-keep-consumers.html?.tsrc=rss,"Tue, 01 Jul 2025 10:00:00 +0000",2025-07-01 06:00:00-04:00,5,2025-07-01 06:00:00-04:00,31.21,31.21,31.21,30.7,32.13,0.0,0.0,1.66,-2.86,0.0,0.0
KHC,Kraft Heinz (KHC) Stock Sinks As Market Gains: Here's Why,"Kraft Heinz (KHC) closed at $26.66 in the latest trading session, marking a -1.48% move from the prior day.",https://finance.yahoo.com/news/kraft-heinz-khc-stock-sinks-220003568.html?.tsrc=rss,"Thu, 03 Jul 2025 22:00:03 +0000",2025-07-03 18:00:03-04:00,2,2025-07-03 18:00:03-04:00,26.62,26.62,26.62,27.05,25.79,0.0,0.0,-1.59,3.22,-0.1,0.0
KHC,Kraft Heinz Recalls Oscar Meyer Turkey Bacon on Possible Listeria Contamination,"Kraft Heinz has recalled about 380,000 pounds of turkey bacon because of the possibility it is contaminated with listeria.",https://www.investopedia.com/kraft-heinz-recalls-oscar-meyer-turkey-bacon-on-possible-listeria-contamination-11766146?.tsrc=rss,"Thu, 03 Jul 2025 15:25:46 +0000",2025-07-03 11:25:46-04:00,2,2025-07-03 11:25:46-04:00,26.62,26.68,26.72,26.83,25.81,-0.22,-0.37,-0.78,3.14,0.0,0.0
KR,The Kroger Co. (NYSE:KR) Delivered A Better ROE Than Its Industry,"While some investors are already well versed in financial metrics (hat tip), this article is for those who would like...",https://finance.yahoo.com/news/kroger-co-nyse-kr-delivered-140013602.html?.tsrc=rss,"Thu, 03 Jul 2025 14:00:13 +0000",2025-07-03 10:00:13-04:00,3,2025-07-03 10:00:13-04:00,69.32,69.25,69.25,70.35,71.85,0.1,0.1,-1.46,-3.52,0.5,0.27
DLR,Digital Realty Schedules Second Quarter 2025 Earnings Release and Conference Call,"Digital Realty (NYSE: DLR), the largest global provider of cloud- and carrier-neutral data center, colocation, and interconnection solutions, announced today that it will release financial results for the second quarter of 2025 after the market closes on Thursday, July 24, 2025. The company will host a conference call to discuss these results at 5:00 p.m. ET / 4:00 p.m. CT on Thursday, July 24, 2025.",https://finance.yahoo.com/news/digital-realty-schedules-second-quarter-200500947.html?.tsrc=rss,"Tue, 01 Jul 2025 20:05:00 +0000",2025-07-01 16:05:00-04:00,4,2025-07-01 16:05:00-04:00,171.24,171.24,171.57,174.32,177.65,0.0,-0.19,-1.77,-3.61,0.0,0.18
DLR,"Digital Realty Published 2024 Impact Report, Highlighting Advancements in Sustainability Goals","Digital Realty (NYSE: DLR), the largest global provider of cloud- and carrier-neutral data center, colocation, and interconnection solutions, has released its 2024 Impact Report, showcasing the company's sustainability performance, including a comprehensive overview of its clean energy commitment, resource conservation and other sustainable business practices.",https://finance.yahoo.com/news/digital-realty-published-2024-impact-110000815.html?.tsrc=rss,"Tue, 01 Jul 2025 11:00:00 +0000",2025-07-01 07:00:00-04:00,5,2025-07-01 07:00:00-04:00,171.75,171.75,171.75,172.92,177.8,0.0,0.0,-0.68,-3.4,0.0,0.84
DRI,Wine-tasting event returns to Capital Grille,"Generous Pour offers six wines, including new on-premises-only release",https://www.nrn.com/beverage-trends/wine-tasting-event-returns-to-capital-grille?.tsrc=rss,"Thu, 03 Jul 2025 19:01:51 +0000",2025-07-03 15:01:51-04:00,2,2025-07-03 15:01:51-04:00,219.47,219.47,219.47,219.34,215.92,0.0,0.0,0.06,1.64,0.0,0.51
DRI,Are You Missing Out on These 2 Dividend Raises From Famous Companies?,"Both a very familiar retailer and a high-profile restaurant chain operator are cranking their distributions higher.  Over the past few days, there emerged two major exceptions to this trend -- monster retailer Target (NYSE: TGT) and Darden Restaurants (NYSE: DRI), owner and operator of well-known dining chains such as Olive Garden, Ruth's Chris Steak House, and The Capital Grille.  Of the two dividend raises, Target's was the more predictable.",https://www.fool.com/investing/2025/06/27/are-you-missing-out-on-these-2-dividend-raises-fro/?.tsrc=rss,"Fri, 27 Jun 2025 21:05:00 +0000",2025-06-27 17:05:00-04:00,8,2025-06-27 17:05:00-04:00,216.12,216.12,214.09,215.92,225.44,0.0,0.95,0.09,-4.13,0.15,0.0
DRI,Swing Trading Lesson: Why We Took The Small Gain In Shake Shack While We Had It,"Or in the case of Shake Shack stock, when they just stop making gains.  On May 27, we could see a number of restaurant stocks having a great day, even though we didn't know the exact reason (1).  Shake Shack was up 7.4% but Darden Restaurants, Brinker International, Texas Roadhouse and Cheesecake Factory were also among the strongest stocks that day with gains of 5% or more.",https://finance.yahoo.com/m/a96ce47c-9b40-3ef3-814d-9afb352b695d/swing-trading-lesson%3A-why-we.html?.tsrc=rss,"Fri, 27 Jun 2025 20:18:27 +0000",2025-06-27 16:18:27-04:00,8,2025-06-27 16:18:27-04:00,216.12,216.12,214.9,215.92,225.44,0.0,0.57,0.09,-4.13,-0.25,0.84
DVA,"Zacks Industry Outlook Highlights Quest Diagnostics, Encompass Health, DaVita and The Pennant","DGX, EHC, DVA, and PNTG are riding the outpatient healthcare shift as tech, AI, and aging demand reshape the care landscape.",https://finance.yahoo.com/news/zacks-industry-outlook-highlights-quest-123700251.html?.tsrc=rss,"Thu, 03 Jul 2025 12:37:00 +0000",2025-07-03 08:37:00-04:00,3,2025-07-03 08:37:00-04:00,143.07,143.07,143.07,142.62,142.16,0.0,0.0,0.32,0.64,0.0,0.4
DVA,4 Stocks to Watch in a Rapidly Shifting Outpatient Home Health Space,"An aging global population and AI dominance are likely to drive the Zacks Medical - Outpatient and Home Healthcare industry despite the macroeconomic challenges. DGX, EHC, DVA and PNTG are well-poised to gain.",https://finance.yahoo.com/news/4-stocks-watch-rapidly-shifting-141000864.html?.tsrc=rss,"Wed, 02 Jul 2025 14:10:00 +0000",2025-07-02 10:10:00-04:00,4,2025-07-02 10:10:00-04:00,144.73,142.62,142.62,147.1,140.71,1.48,1.48,-1.61,2.86,0.0,0.61
DVA,Why DaVita HealthCare (DVA) is a Top Value Stock for the Long-Term,The Zacks Style Scores offers investors a way to easily find top-rated stocks based on their investing style. Here's why you should take advantage.,https://finance.yahoo.com/news/why-davita-healthcare-dva-top-134002829.html?.tsrc=rss,"Wed, 02 Jul 2025 13:40:02 +0000",2025-07-02 09:40:02-04:00,4,2025-07-02 09:40:02-04:00,142.62,142.62,142.62,144.79,140.74,0.0,0.0,-1.5,1.34,0.5,0.53
