Ticker,Title,Summary,URL,Original Published Time,Datetime,News Age (Days),News Time,Current Price,1 Hour Ago,4 Hours Ago,Previous Day Close,7 Days Ago,1 Hour Ago % Change,4 Hours Ago % Change,Previous Day Close % Change,7 Days Ago % Change,Headline Sentiment,Summary Sentiment
LKQ,"LKQ Corporation to Release Second Quarter 2025 Results on Thursday, July 24, 2025","ANTIOCH, Tenn., June 26, 2025 (GLOBE NEWSWIRE) -- LKQ Corporation (Nasdaq: LKQ) will release its second quarter 2025 financial results on Thursday, July 24, 2025. Conference Call Details LKQ will host a conference call and webcast on July 24, 2025 at 8:00 a.m. Eastern Time (7:00 a.m. Central Time) with members of senior management to discuss the Company's results. To access the investor conference call, please dial (833) 470-1428. International access to the call may be obtained by dialing (404)",https://finance.yahoo.com/news/lkq-corporation-release-second-quarter-140000324.html?.tsrc=rss,"Thu, 26 Jun 2025 14:00:00 +0000",2025-06-26 10:00:00-04:00,10,2025-06-26 10:00:00-04:00,36.78,36.78,36.78,37.22,N/A,0.0,0.0,-1.18,N/A,0.0,0.32
LKQ,LKQ Corporation Highlights Strong Sustainability Progress in 2024 Report,"LKQ Corporation (NASDAQ:LKQ) is one of the best S&amp;P 500 stocks with huge upside potential. Towards the end of May, LKQ Corporation released its 2024 Sustainability Report, which was titled “Doing Our Part For a More Sustainable World.” The report emphasized LKQ’s commitment to profitable growth through efficient, responsible, and ethical business practices. The report […]",https://finance.yahoo.com/news/lkq-corporation-highlights-strong-sustainability-204614916.html?.tsrc=rss,"Wed, 25 Jun 2025 20:46:14 +0000",2025-06-25 16:46:14-04:00,10,2025-06-25 16:46:14-04:00,36.94,36.94,37.1,37.67,36.84,0.0,-0.43,-1.94,0.27,0.43,0.97
LKQ,LKQ Corporation (LKQ) Announces Joint Venture Between LKQ Europe and SYNETIQ Ltd.,"LKQ Corporation (NASDAQ:LKQ) is one of the 13 Cheap Mid-Cap Stocks to Add to Your Portfolio. On June 24, LKQ Corporation (NASDAQ:LKQ) announced a joint venture between LKQ Europe and SYNETIQ Ltd., an IAA company. LKQ Europe distributes automotive aftermarket parts for commercial vans, cars, and industrial vehicles in Europe, while SYNETIQ is a UK-based vehicle […]",https://finance.yahoo.com/news/lkq-corporation-lkq-announces-joint-175859227.html?.tsrc=rss,"Wed, 25 Jun 2025 17:58:59 +0000",2025-06-25 13:58:59-04:00,10,2025-06-25 13:58:59-04:00,37.2,37.1,37.22,37.54,37.08,0.27,-0.05,-0.91,0.32,0.0,0.0
LNC,Here's Why Investors Should Retain Lincoln National Stock for Now,"LNC's strong annuity and group protection growth, plus a Bain Capital deal, support gains despite rising costs and debt.",https://finance.yahoo.com/news/heres-why-investors-retain-lincoln-161500706.html?.tsrc=rss,"Tue, 01 Jul 2025 16:15:00 +0000",2025-07-01 12:15:00-04:00,4,2025-07-01 12:15:00-04:00,35.06,35.17,34.53,34.77,33.07,-0.31,1.53,0.83,6.02,0.0,0.82
LNC,Lincoln Financial to Report 2025 Second Quarter Results on July 31,"RADNOR, Pa., June 27, 2025--Lincoln Financial (NYSE:LNC) announced today that it will report its results for the second quarter ended June 30, at 6:00 a.m. Eastern Time on Thursday, July 31, 2025. A conference call is scheduled for 8:00 a.m. Eastern Time on the same day. Earnings materials, including the 2025 second quarter Earnings Release, Earnings Supplement, and Statistical Supplement, will be available on the company’s Investor Relations web page at www.lincolnfinancial.com/investor.",https://finance.yahoo.com/news/lincoln-financial-report-2025-second-203000315.html?.tsrc=rss,"Fri, 27 Jun 2025 20:30:00 +0000",2025-06-27 16:30:00-04:00,8,2025-06-27 16:30:00-04:00,34.55,34.55,34.83,34.53,33.0,0.0,-0.8,0.06,4.7,0.0,0.0
LNC,3 Reasons to Sell LNC and 1 Stock to Buy Instead,"Since December 2024, Lincoln Financial Group has been in a holding pattern, posting a small return of 3.2% while floating around $33.15.",https://finance.yahoo.com/news/3-reasons-sell-lnc-1-040527774.html?.tsrc=rss,"Wed, 25 Jun 2025 04:05:27 +0000",2025-06-25 00:05:27-04:00,11,2025-06-25 00:05:27-04:00,32.91,33.16,33.16,33.42,33.28,-0.75,-0.75,-1.53,-1.11,0.0,0.0
LRCX,Lam Research (LRCX) Exceeds Market Returns: Some Facts to Consider,"Lam Research (LRCX) concluded the recent trading session at $98.83, signifying a +2.09% move from its prior day's close.",https://finance.yahoo.com/news/lam-research-lrcx-exceeds-market-215005738.html?.tsrc=rss,"Wed, 02 Jul 2025 21:50:05 +0000",2025-07-02 17:50:05-04:00,3,2025-07-02 17:50:05-04:00,98.84,98.84,98.49,96.82,96.05,0.0,0.36,2.09,2.9,0.0,0.0
LRCX,2 Reasons to Like LRCX (and 1 Not So Much),"Since July 2020, the S&amp;P 500 has delivered a total return of 97.8%. But one standout stock has doubled the market - over the past five years, Lam Research has surged 200% to $97.19 per share. Its momentum hasn’t stopped as it’s also gained 34.2% in the last six months thanks to its solid quarterly results, beating the S&amp;P by 28.5%.",https://finance.yahoo.com/news/2-reasons-lrcx-1-not-040358891.html?.tsrc=rss,"Wed, 02 Jul 2025 04:03:58 +0000",2025-07-02 00:03:58-04:00,4,2025-07-02 00:03:58-04:00,96.89,96.82,96.82,95.94,96.22,0.07,0.07,0.99,0.7,0.2,0.68
LW,Here's What to Expect From Lamb Weston's Next Earnings Report,"Lamb Weston is expected to release its fourth-quarter results later this month, and analysts expect a double-digit drop in earnings.",https://www.barchart.com/story/news/33190747/here-s-what-to-expect-from-lamb-weston-s-next-earnings-report?.tsrc=rss,"Thu, 03 Jul 2025 07:13:56 +0000",2025-07-03 03:13:56-04:00,3,2025-07-03 03:13:56-04:00,52.54,52.54,52.75,53.11,53.38,0.0,-0.4,-1.07,-1.57,0.0,-0.27
LW,"Lamb Weston to Announce Fiscal Year 2025 Fourth Quarter and Full Year Financial Results on July 23, 2025","EAGLE, Ind., July 02, 2025--Lamb Weston Holdings, Inc. (NYSE: LW) announced today it will report fiscal 2025 fourth quarter and full year financial results on July 23, 2025. The news release will be issued at approximately 8:00 a.m. ET, followed by a conference call at 10:00 a.m. ET.",https://finance.yahoo.com/news/lamb-weston-announce-fiscal-2025-133000014.html?.tsrc=rss,"Wed, 02 Jul 2025 13:30:00 +0000",2025-07-02 09:30:00-04:00,4,2025-07-02 09:30:00-04:00,53.11,53.11,53.11,52.06,53.03,0.0,0.0,2.02,0.15,0.12,0.0
LW,Shelf-Stable Food Stocks Q1 Earnings: Lamb Weston (NYSE:LW) Best of the Bunch,"Looking back on shelf-stable food stocks’ Q1 earnings, we examine this quarter’s best and worst performers, including Lamb Weston (NYSE:LW) and its peers.",https://finance.yahoo.com/news/shelf-stable-food-stocks-q1-033821706.html?.tsrc=rss,"Tue, 01 Jul 2025 03:38:21 +0000",2025-06-30 23:38:21-04:00,5,2025-06-30 23:38:21-04:00,51.86,51.86,51.86,N/A,54.08,0.0,0.0,N/A,-4.11,1.0,0.03
LVS,Las Vegas Sands (LVS) Soars 8.89% as Macau Gaming Raises Revenue Prospects,"Las Vegas Sands Corp. (NYSE:LVS) is one of These 10 Stocks Went Bulletproof. Las Vegas Sands jumped by 8.89 percent on Tuesday to close at $47.38 apiece as investors scooped up shares following news that Macau’s gaming revenues in June surged by 19 percent year-on-year. On Tuesday, the Gaming Inspection and Coordination Bureau of Macau […]",https://finance.yahoo.com/news/las-vegas-sands-lvs-soars-004809710.html?.tsrc=rss,"Thu, 03 Jul 2025 00:48:09 +0000",2025-07-02 20:48:09-04:00,3,2025-07-02 20:48:09-04:00,47.83,47.83,47.83,47.39,42.9,0.0,0.0,0.93,11.49,0.0,0.3
LVS,Las Vegas Sands (NYSE:LVS) Announces US$2 Billion Buyback Authorization Increase,"Las Vegas Sands (NYSE:LVS) experienced a notable 21% increase in its share price over the last quarter. The company's decision to repurchase over 10 million shares for nearly $450 million and the announcement of a buyback authorization increase to $2 billion likely supported this upward movement. Additionally, the declaration of a quarterly cash dividend may have provided further encouragement to investors looking for income. Although the company's earnings report showed a decline in sales...",https://finance.yahoo.com/news/las-vegas-sands-nyse-lvs-175216404.html?.tsrc=rss,"Wed, 02 Jul 2025 17:52:16 +0000",2025-07-02 13:52:16-04:00,3,2025-07-02 13:52:16-04:00,47.66,47.56,47.56,47.35,42.85,0.21,0.21,0.65,11.23,0.0,0.9
MAR,Marriott to launch three new hotels in Canada by 2030,"The W, JW Marriott, and an Autograph Collection properties are scheduled to open in 2028, 2029, and 2030, respectively.",https://www.hotelmanagement-network.com/news/marriott-three-new-hotels-canada/?.tsrc=rss,"Thu, 03 Jul 2025 15:06:40 +0000",2025-07-03 11:06:40-04:00,2,2025-07-03 11:06:40-04:00,279.67,279.6,281.03,276.23,269.74,0.03,-0.48,1.25,3.68,0.14,0.69
MAR,Why major hotels are growing their presence in Africa,"Driven by growing tourism, business travel, and a rising middle class, Africa is increasingly offering strong opportunities for hotel brands.",https://www.hotelmanagement-network.com/features/why-major-hotels-are-growing-their-presence-in-africa/?.tsrc=rss,"Thu, 03 Jul 2025 08:08:40 +0000",2025-07-03 04:08:40-04:00,3,2025-07-03 04:08:40-04:00,281.03,281.03,281.03,276.6,269.15,0.0,0.0,1.6,4.41,0.06,0.77
MAS,Masco Corporation Announces Date for Earnings Release and Conference Call for 2025 Second Quarter,"LIVONIA, Mich., July 01, 2025--Masco Corporation (NYSE: MAS) announced today that it will hold a conference call regarding 2025 second quarter results on Thursday, July 31 at 8:00 a.m. ET. The conference call will be hosted by Masco President and Chief Executive Officer Jon Nudi. Participants in the call are asked to register five to ten minutes prior to the scheduled start time by dialing (800) 549-8228 or (289) 819-1520. Please use the conference identification number 73279.",https://finance.yahoo.com/news/masco-corporation-announces-date-earnings-120000121.html?.tsrc=rss,"Tue, 01 Jul 2025 12:00:00 +0000",2025-07-01 08:00:00-04:00,5,2025-07-01 08:00:00-04:00,65.77,65.77,65.77,64.19,63.6,0.0,0.0,2.46,3.41,0.0,0.38
MAS,Q1 Rundown: Masco (NYSE:MAS) Vs Other Home Construction Materials Stocks,"As the Q1 earnings season comes to a close, it’s time to take stock of this quarter’s best and worst performers in the home construction materials industry, including Masco (NYSE:MAS) and its peers.",https://finance.yahoo.com/news/q1-rundown-masco-nyse-mas-033702690.html?.tsrc=rss,"Tue, 24 Jun 2025 03:37:02 +0000",2025-06-23 23:37:02-04:00,12,2025-06-23 23:37:02-04:00,62.95,62.95,62.95,N/A,62.47,0.0,0.0,N/A,0.77,-0.12,0.03
MAS,Is Masco Stock Underperforming the Dow?,"Even though Masco has underperformed the Dow over the past year, analysts remain moderately optimistic about the stock’s prospects.",https://www.barchart.com/story/news/33003502/is-masco-stock-underperforming-the-dow?.tsrc=rss,"Mon, 23 Jun 2025 14:16:34 +0000",2025-06-23 10:16:34-04:00,13,2025-06-23 10:16:34-04:00,61.44,61.52,61.52,N/A,62.1,-0.13,-0.13,N/A,-1.06,0.0,0.54
MKC,"Zacks Industry Outlook Highlights Mondelez International, Sysco, McCormick and Celsius","MDLZ, SYY, MKC, and CELH lean on innovation and efficiency to combat inflation and shifting food-buying habits.",https://finance.yahoo.com/news/zacks-industry-outlook-highlights-mondelez-124700318.html?.tsrc=rss,"Thu, 03 Jul 2025 12:47:00 +0000",2025-07-03 08:47:00-04:00,3,2025-07-03 08:47:00-04:00,75.26,75.26,75.26,76.32,77.49,0.0,0.0,-1.39,-2.88,0.0,0.4
MKC,"North America Seasonings and Spices Market Analysis Report 2025-2033 | Bold Flavors, Health Trends, and Home Cooking Spur Growth","The North American Seasonings and Spices Market is projected to grow from US$ 3.93 billion in 2024 to US$ 6.15 billion by 2033, at a CAGR of 5.10%. This growth is fueled by an increasing consumer preference for bold flavors, health-conscious eating, and ethnic cuisines. The demand for natural and organic products, coupled with the rise of home cooking, further enhances market expansion. E-commerce and foodservice advancements, along with innovative ethnic and functional seasoning blends, drive t",https://finance.yahoo.com/news/north-america-seasonings-spices-market-111900857.html?.tsrc=rss,"Wed, 02 Jul 2025 11:19:00 +0000",2025-07-02 07:19:00-04:00,4,2025-07-02 07:19:00-04:00,76.32,76.32,76.32,76.18,74.26,0.0,0.0,0.18,2.77,0.33,0.84
MKC,The J. M. Smucker Slides 12% in a Month: How to Play SJM Stock,"SJM slides 12% in a month as weak snacks, costly coffee, and tariffs deepen pressure on margins and investor confidence.",https://finance.yahoo.com/news/j-m-smucker-slides-12-152400602.html?.tsrc=rss,"Tue, 01 Jul 2025 15:24:00 +0000",2025-07-01 11:24:00-04:00,4,2025-07-01 11:24:00-04:00,77.57,77.26,76.18,75.34,74.17,0.4,1.82,2.96,4.58,0.0,-0.3
MCO,"WisdomTree, Inc. (WT) Moves 6.6% Higher: Will This Strength Last?","WisdomTree, Inc. (WT) witnessed a jump in share price last session on above-average trading volume. The latest trend in earnings estimate revisions for the stock doesn't suggest further strength down the road.",https://finance.yahoo.com/news/wisdomtree-inc-wt-moves-6-103100060.html?.tsrc=rss,"Thu, 03 Jul 2025 10:31:00 +0000",2025-07-03 06:31:00-04:00,3,2025-07-03 06:31:00-04:00,501.18,501.18,501.18,502.27,480.89,0.0,0.0,-0.22,4.22,0.12,-0.11
MCO,"JPMorgan’s Risky, 5-Day Dash to Help Warner Bros. Split in Two",(Bloomberg) -- The bankers from JPMorgan Chase & Co. knew the deal they were cooking up would face fierce opposition. Most Read from BloombergStruggling Downtowns Are Looking to Lure New CrowdsNYC Commutes Resume After Midtown Bus Terminal Crash ChaosWhat Gothenburg Got Out of Congestion PricingCalifornia Exempts Building Projects From Environmental LawMassachusetts to Follow NYC in Making Landlords Pay Broker FeesThe plan could leave creditors of Warner Bros. Discovery Inc. with billions less t,https://finance.yahoo.com/news/jpmorgan-risky-5-day-dash-150052424.html?.tsrc=rss,"Wed, 02 Jul 2025 15:00:52 +0000",2025-07-02 11:00:52-04:00,3,2025-07-02 11:00:52-04:00,500.05,500.79,502.27,501.38,480.89,-0.15,-0.44,-0.27,3.98,0.0,-0.51
MSI,Motorola launches its most intelligent smartphones yet - the motorola razr 60 and motorola edge 60 pro,"Mobile communications leader, Motorola, is introducing two of its most intelligent devices yet to the Australian market, the motorola razr 60 and motorola edge 60 pro. Equipped with moto ai, both devices exemplify Motorola's leadership in simplifying everyday tasks through intuitive AI.",https://finance.yahoo.com/news/motorola-launches-most-intelligent-smartphones-011800509.html?.tsrc=rss,"Thu, 03 Jul 2025 01:18:00 +0000",2025-07-02 21:18:00-04:00,3,2025-07-02 21:18:00-04:00,421.96,421.96,421.96,425.51,419.03,0.0,0.0,-0.83,0.7,0.65,0.51
MSI,Verra Mobility appoints Stacey Moser to lead its Commercial Services business,"Verra Mobility Corporation (NASDAQ: VRRM), a leading provider of smart mobility technology solutions, announced today that Stacey Moser has been appointed as Executive Vice President and General Manager of the company's Commercial Services business unit effective July 21, 2025. She will report directly to David Roberts, CEO of Verra Mobility.",https://finance.yahoo.com/news/verra-mobility-appoints-stacey-moser-201500883.html?.tsrc=rss,"Wed, 02 Jul 2025 20:15:00 +0000",2025-07-02 16:15:00-04:00,3,2025-07-02 16:15:00-04:00,421.96,421.96,419.11,425.51,419.03,0.0,0.68,-0.83,0.7,0.0,0.76
MSCI,Here’s Rothschild &Co LongRun Equity’s Case Study on MSCI (MSCI),"Rothschild & Co Wealth Management, an investment management company, released its LongRun Equity strategy first quarter 2025 investor letter. A copy of the letter can be downloaded here. The firm is a committed long-term business owner, focused on a portfolio of high-quality companies. The strategy declined 6.6% (in EUR, unhedged) in the first quarter compared […]",https://finance.yahoo.com/news/rothschild-co-longrun-equity-case-131908413.html?.tsrc=rss,"Thu, 03 Jul 2025 13:19:08 +0000",2025-07-03 09:19:08-04:00,3,2025-07-03 09:19:08-04:00,587.1,587.1,587.1,581.44,565.41,0.0,0.0,0.97,3.84,0.0,0.78
MSCI,What You Need to Know Ahead of MSCI's Earnings Release,"MSCI will release its second-quarter earnings later this month, and analysts anticipate a double-digit bottom-line growth.",https://www.barchart.com/story/news/33168282/what-you-need-to-know-ahead-of-msci-s-earnings-release?.tsrc=rss,"Wed, 02 Jul 2025 10:34:49 +0000",2025-07-02 06:34:49-04:00,4,2025-07-02 06:34:49-04:00,581.44,581.44,581.44,575.95,562.0,0.0,0.0,0.95,3.46,0.0,0.38
MSCI,"MSCI's New Subscription Bookings to Decline in Q2, RBC Capital Says",MSCI's (MSCI) net new subscription bookings are expected to decline by nearly 18% year-over-year to,https://finance.yahoo.com/news/msci-apos-subscription-bookings-decline-143922180.html?.tsrc=rss,"Tue, 01 Jul 2025 14:39:22 +0000",2025-07-01 10:39:22-04:00,4,2025-07-01 10:39:22-04:00,581.64,575.95,575.95,572.07,569.71,0.99,0.99,1.67,2.09,0.14,0.0
MTB,USB vs. MTB: Which Regional Banking Stock Holds More Upside?,"Can U.S. Bancorp's fintech moves, rising NII, and discounted valuation outshine M&amp;T Bank's growth in 2025? Let's delve into it.",https://finance.yahoo.com/news/usb-vs-mtb-regional-banking-172600485.html?.tsrc=rss,"Wed, 02 Jul 2025 17:26:00 +0000",2025-07-02 13:26:00-04:00,3,2025-07-02 13:26:00-04:00,199.41,198.17,197.49,197.35,190.78,0.63,0.97,1.04,4.52,0.5,0.42
MTB,Why M&T Bank Corporation (MTB) is a Top Dividend Stock for Your Portfolio,"Dividends are one of the best benefits to being a shareholder, but finding a great dividend stock is no easy task. Does M&amp;T Bank Corporation (MTB) have what it takes? Let's find out.",https://finance.yahoo.com/news/why-m-t-bank-corporation-154512864.html?.tsrc=rss,"Wed, 02 Jul 2025 15:45:12 +0000",2025-07-02 11:45:12-04:00,3,2025-07-02 11:45:12-04:00,198.6,198.3,197.49,198.6,189.98,0.15,0.56,0.0,4.54,0.5,0.9
MTB,M&T Bank's (NYSE:MTB) 19% CAGR outpaced the company's earnings growth over the same five-year period,"When you buy shares in a company, it's worth keeping in mind the possibility that it could fail, and you could lose...",https://finance.yahoo.com/news/m-t-banks-nyse-mtb-110015431.html?.tsrc=rss,"Wed, 02 Jul 2025 11:00:15 +0000",2025-07-02 07:00:15-04:00,4,2025-07-02 07:00:15-04:00,197.49,197.49,197.49,194.91,189.02,0.0,0.0,1.32,4.48,0.0,-0.1
MNST,UBS Maintains Neutral on Monster Beverage Despite Rising Aluminum Tariffs,"Monster Beverage Corporation (NASDAQ:MNST) ranks among the best FMCG stocks to buy. On June 16, UBS maintained its Neutral rating and $63 price target on Monster Beverage Corporation (NASDAQ:MNST), anticipating that higher aluminum tariffs will have a modest impact on the company’s margins beginning in the third quarter of 2025. At its annual shareholder meeting, […]",https://finance.yahoo.com/news/ubs-maintains-neutral-monster-beverage-130924200.html?.tsrc=rss,"Thu, 03 Jul 2025 13:09:24 +0000",2025-07-03 09:09:24-04:00,3,2025-07-03 09:09:24-04:00,62.65,62.65,62.65,63.51,62.7,0.0,0.0,-1.35,-0.08,0.0,0.64
MNST,Jim Cramer on Monster Beverage: “I Would Not Walk Away From That”,"Monster Beverage Corporation (NASDAQ:MNST) is one of the 21 stocks on Jim Cramer’s radar. Mentioning that they have offloaded their cost bases, a caller asked what they should do with the rest of their position in the stock. Here’s what Cramer had to say: “The answer is you own it. Do you know that Monster, […]",https://finance.yahoo.com/news/jim-cramer-monster-beverage-not-062424858.html?.tsrc=rss,"Wed, 02 Jul 2025 06:24:24 +0000",2025-07-02 02:24:24-04:00,4,2025-07-02 02:24:24-04:00,63.51,63.51,63.54,63.46,62.82,0.0,-0.05,0.08,1.1,0.0,0.0
MNST,Does Monster Beverage (NASDAQ:MNST) Have A Healthy Balance Sheet?,"Some say volatility, rather than debt, is the best way to think about risk as an investor, but Warren Buffett famously...",https://finance.yahoo.com/news/does-monster-beverage-nasdaq-mnst-110036096.html?.tsrc=rss,"Tue, 01 Jul 2025 11:00:36 +0000",2025-07-01 07:00:36-04:00,5,2025-07-01 07:00:36-04:00,63.46,63.46,63.46,62.14,63.27,0.0,0.0,2.12,0.3,0.5,0.08
MPC,Marathon Petroleum (MPC) Outpaces Stock Market Gains: What You Should Know,"Marathon Petroleum (MPC) closed the most recent trading day at $174.46, moving +2.65% from the previous trading session.",https://finance.yahoo.com/news/marathon-petroleum-mpc-outpaces-stock-214504139.html?.tsrc=rss,"Wed, 02 Jul 2025 21:45:04 +0000",2025-07-02 17:45:04-04:00,3,2025-07-02 17:45:04-04:00,174.44,174.44,173.48,169.93,165.75,0.0,0.55,2.65,5.24,0.0,0.0
MPC,Is Most-Watched Stock Marathon Petroleum Corporation (MPC) Worth Betting on Now?,"Zacks.com users have recently been watching Marathon Petroleum (MPC) quite a bit. Thus, it is worth knowing the facts that could determine the stock's prospects.",https://finance.yahoo.com/news/most-watched-stock-marathon-petroleum-130002261.html?.tsrc=rss,"Wed, 02 Jul 2025 13:00:02 +0000",2025-07-02 09:00:02-04:00,4,2025-07-02 09:00:02-04:00,170.72,170.72,170.72,166.36,165.49,0.0,0.0,2.62,3.16,0.3,0.48
MPC,Marathon at the Finish Line: Is Value Fully Priced In?,"Marathon Petroleum release its first quarter of 2025 on May 6, 2025.",https://finance.yahoo.com/news/marathon-finish-line-value-fully-180738047.html?.tsrc=rss,"Mon, 30 Jun 2025 18:07:38 +0000",2025-06-30 14:07:38-04:00,5,2025-06-30 14:07:38-04:00,166.22,166.13,167.0,N/A,166.38,0.05,-0.47,N/A,-0.1,0.0,0.0
NDAQ,Delisting of Securities from The Nasdaq Stock Market,"NEW YORK, July 02, 2025 (GLOBE NEWSWIRE) -- The Nasdaq Stock Market announced today that it will delist the American Depositary Shares of Advanced Health Intelligence Ltd. Advanced Health Intelligence Ltd.’s security was suspended on July 30, 2024 and has not traded on Nasdaq since that time. Nasdaq also announced today that it will delist the ordinary shares and warrants of noco-noco Inc. noco-noco Inc.’s securities were suspended on November 25, 2024 and have not traded on Nasdaq since that ti",https://finance.yahoo.com/news/delisting-securities-nasdaq-stock-market-200500887.html?.tsrc=rss,"Wed, 02 Jul 2025 20:05:00 +0000",2025-07-02 16:05:00-04:00,3,2025-07-02 16:05:00-04:00,89.53,89.53,89.57,88.96,88.06,0.0,-0.04,0.64,1.67,0.0,0.88
NDAQ,"LA CorpGov Forum Sept 4: Featuring Sports, Entertainment, IPOs, VCs, Activism & Asia","CorpGov will launch the inaugural LA CorpGov Forum on Thursday, September 4, 2025, at 1500 N El Centro Ave, Los Angeles, California, in the heart of Hollywood. The forum will […]",https://finance.yahoo.com/news/la-corpgov-forum-sept-4-195420623.html?.tsrc=rss,"Wed, 02 Jul 2025 19:54:20 +0000",2025-07-02 15:54:20-04:00,3,2025-07-02 15:54:20-04:00,89.53,89.5,89.51,88.96,88.06,0.03,0.02,0.64,1.67,0.0,0.0
NDAQ,Nasdaq Tops NYSE in H1 IPOs With $21.3 Billion Raised,Nasdaq raised $21.3 billion in IPOs during H1 2025 vs. $8.7 billion for NYSE,https://finance.yahoo.com/news/nasdaq-tops-nyse-h1-ipos-073923642.html?.tsrc=rss,"Wed, 02 Jul 2025 07:39:23 +0000",2025-07-02 03:39:23-04:00,4,2025-07-02 03:39:23-04:00,89.26,89.26,88.96,89.15,88.07,0.0,0.34,0.12,1.35,0.0,0.0
NCLH,Norwegian Cruise Line (NCLH) Surpasses Market Returns: Some Facts Worth Knowing,"In the most recent trading session, Norwegian Cruise Line (NCLH) closed at $21.37, indicating a +1.86% shift from the previous trading day.",https://finance.yahoo.com/news/norwegian-cruise-line-nclh-surpasses-220004951.html?.tsrc=rss,"Wed, 02 Jul 2025 22:00:04 +0000",2025-07-02 18:00:04-04:00,3,2025-07-02 18:00:04-04:00,21.38,21.38,21.3,21.01,19.02,0.0,0.38,1.76,12.41,0.15,0.0
NEM,"Goldgroup Completes Acquisition of Fully Permitted, Advanced-Stage Pinos Gold Project in Mexico","VANCOUVER, BC / ACCESS Newswire / July 3, 2025 /Goldgroup Mining Inc. (""Goldgroup"" or the ""Company"") (TSXV:GGA)(OTCID:GGAZF) is pleased to report that it has closed the previously announced acquisition of a 100% interest in the fully permitted for ...",https://finance.yahoo.com/news/goldgroup-completes-acquisition-fully-permitted-220000877.html?.tsrc=rss,"Thu, 03 Jul 2025 22:00:00 +0000",2025-07-03 18:00:00-04:00,2,2025-07-03 18:00:00-04:00,59.82,59.82,59.82,60.07,59.2,0.0,0.0,-0.42,1.05,0.0,0.71
NEM,Newmont (NEM) Sharpens Strategic Focus as Gold Demand Surges,"Newmont Corporation (NYSE:NEM) is one of the 20 undervalued momentum stocks that are taking off. While Newmont’s recent asset sale reflects a portfolio realignment toward core operations, the firm stands to benefit from structural support for gold prices and robust demand from central banks in the medium term. A subsidiary of Newmont Corp. recently announced the […]",https://finance.yahoo.com/news/newmont-nem-sharpens-strategic-focus-133426515.html?.tsrc=rss,"Thu, 03 Jul 2025 13:34:26 +0000",2025-07-03 09:34:26-04:00,3,2025-07-03 09:34:26-04:00,59.88,59.88,59.88,59.63,58.53,0.0,0.0,0.42,2.31,0.0,0.84
NTRS,Northern Trust (NasdaqGS:NTRS) Proposes 7% Dividend Increase Pending Board Approval,"Northern Trust (NasdaqGS:NTRS) has proposed a 7% increase in its quarterly cash dividend, reflecting its intent to enhance shareholder returns. Over the last quarter, the company's stock price surged 30%. This upward trend aligns with its strong first-quarter earnings report, which showed significant rises in net interest income and net income, enhancing investor confidence. Additionally, rumors of a potential acquisition by The Bank of New York Mellon and strategic client partnerships may...",https://finance.yahoo.com/news/northern-trust-nasdaqgs-ntrs-proposes-173913945.html?.tsrc=rss,"Wed, 02 Jul 2025 17:39:13 +0000",2025-07-02 13:39:13-04:00,3,2025-07-02 13:39:13-04:00,130.65,130.52,128.96,127.56,122.83,0.1,1.31,2.42,6.37,0.0,0.94
