Ticker,Title,Summary,URL,Original Published Time,Datetime,News Age (Days),News Time,Current Price,1 Hour Ago,4 Hours Ago,Previous Day Close,7 Days Ago,1 Hour Ago % Change,4 Hours Ago % Change,Previous Day Close % Change,7 Days Ago % Change,Headline Sentiment,Summary Sentiment
TXN,Verra Mobility appoints Stacey Moser to lead its Commercial Services business,"Verra Mobility Corporation (NASDAQ: VRRM), a leading provider of smart mobility technology solutions, announced today that Stacey Moser has been appointed as Executive Vice President and General Manager of the company's Commercial Services business unit effective July 21, 2025. She will report directly to David Roberts, CEO of Verra Mobility.",https://finance.yahoo.com/news/verra-mobility-appoints-stacey-moser-201500883.html?.tsrc=rss,"Wed, 02 Jul 2025 20:15:00 +0000",2025-07-02 16:15:00-04:00,3,2025-07-02 16:15:00-04:00,215.59,215.59,215.54,210.48,205.44,0.0,0.02,2.43,4.94,0.0,0.76
UNP,Union Pacific Celebrates its 163rd Birthday with New Commemorative No. 1616 Lincoln Locomotive in President Lincoln’s Hometown,"SPRINGFIELD, Ill., July 01, 2025--Union Pacific Railroad celebrated its 163rd birthday today in the hometown of its famed founder – President Abraham Lincoln – with the help of numerous dignitaries and its newest commemorative locomotive that honors Lincoln’s role in laying the foundation for America’s best-in-the-world freight rail system.",https://finance.yahoo.com/news/union-pacific-celebrates-163rd-birthday-211800971.html?.tsrc=rss,"Tue, 01 Jul 2025 21:18:00 +0000",2025-07-01 17:18:00-04:00,4,2025-07-01 17:18:00-04:00,235.53,235.53,235.33,230.05,227.95,0.0,0.08,2.38,3.33,0.14,0.88
UNP,Can Berkshire Hathaway's Railroad Subsidiary Power its Growth?,"BNSF boosts BRK.B's earnings with strong Q1 performance, reinforcing its role as a core cash engine for the conglomerate.",https://finance.yahoo.com/news/berkshire-hathaways-railroad-subsidiary-power-154800454.html?.tsrc=rss,"Mon, 30 Jun 2025 15:48:00 +0000",2025-06-30 11:48:00-04:00,5,2025-06-30 11:48:00-04:00,230.16,230.85,231.49,N/A,222.66,-0.3,-0.57,N/A,3.37,0.0,0.68
UNP,What Makes Union Pacific’s Railroad Network Hard to Replace,"Union Pacific Corporation (NYSE:UNP) is one of the Best Wide Moat Dividend Stocks to Invest in. Union Pacific Corporation (NYSE:UNP) is one of the largest railroads in North America, operating mainly in the western two-thirds of the US. It also connects with Canadian rail networks and serves all six major gateways to Mexico. While it […]",https://finance.yahoo.com/news/makes-union-pacific-railroad-network-010424356.html?.tsrc=rss,"Fri, 27 Jun 2025 01:04:24 +0000",2025-06-26 21:04:24-04:00,9,2025-06-26 21:04:24-04:00,229.43,229.43,229.43,226.82,N/A,0.0,0.0,1.15,N/A,-0.29,0.64
USB,Improve Your Retirement Income with These 3 Top-Ranked Dividend Stocks,"The traditional retirement planning approaches no longer cover all expenses in nest egg years. So what can retirees do? Thankfully, there are alternative investments that provide steady, higher-rate income streams to replace dwindling bond yields.",https://finance.yahoo.com/news/improve-retirement-income-3-top-131002281.html?.tsrc=rss,"Thu, 03 Jul 2025 13:10:02 +0000",2025-07-03 09:10:02-04:00,3,2025-07-03 09:10:02-04:00,47.8,47.8,47.8,46.82,45.46,0.0,0.0,2.09,5.15,0.0,0.15
USB,"Major US Banks to Benefit From 'Re-Emergence' of Capital Markets, Morgan Stanley Says","Major US banks are set to benefit from the ""re-emergence"" of capital markets as increased equities t",https://finance.yahoo.com/news/major-us-banks-benefit-apos-112236735.html?.tsrc=rss,"Thu, 03 Jul 2025 11:22:36 +0000",2025-07-03 07:22:36-04:00,3,2025-07-03 07:22:36-04:00,47.8,47.8,47.8,46.82,45.46,0.0,0.0,2.09,5.15,0.06,0.62
VZ,Why Verizon Communications (VZ) is a Top Momentum Stock for the Long-Term,"Whether you're a value, growth, or momentum investor, finding strong stocks becomes easier with the Zacks Style Scores, a top feature of the Zacks Premium research service.",https://finance.yahoo.com/news/why-verizon-communications-vz-top-135002203.html?.tsrc=rss,"Thu, 03 Jul 2025 13:50:02 +0000",2025-07-03 09:50:02-04:00,3,2025-07-03 09:50:02-04:00,43.47,43.47,43.47,43.72,41.92,0.0,0.0,-0.57,3.7,0.5,0.9
XEL,Xcel Energy Second Quarter 2025 Earnings Conference Call,"MINNEAPOLIS, July 01, 2025--On Thursday, July 31, 2025, Xcel Energy (NASDAQ: XEL) will host a conference call to review second quarter 2025 financial results. The earnings report will be released prior to the market open on the same date.",https://finance.yahoo.com/news/xcel-energy-second-quarter-2025-214000786.html?.tsrc=rss,"Tue, 01 Jul 2025 21:40:00 +0000",2025-07-01 17:40:00-04:00,4,2025-07-01 17:40:00-04:00,68.72,68.72,68.54,68.08,68.25,0.0,0.26,0.94,0.69,0.0,0.27
XEL,Xcel Energy Names Ryan Long Executive Vice President and Chief Legal and Compliance Officer,"MINNEAPOLIS, June 16, 2025--Xcel Energy announced today Ryan Long as the company’s executive vice president and chief legal and compliance officer, effective immediately. Long, currently president of Xcel Energy – Minnesota, North Dakota and South Dakota, takes over the role held by Rob Berntsen, who accepted a position outside the company.",https://finance.yahoo.com/news/xcel-energy-names-ryan-long-203000847.html?.tsrc=rss,"Mon, 16 Jun 2025 20:30:00 +0000",2025-06-16 16:30:00-04:00,19,2025-06-16 16:30:00-04:00,66.78,66.78,66.89,N/A,68.38,0.0,-0.16,N/A,-2.34,0.08,0.65
ABNB,La Caisse firmly rejects allegations that it facilitates or encourages international crimes through its investments,"Following the publication of the report by United Nations Special Rapporteur Francesca Albanese, La Caisse wishes to be clear and firmly rejects allegations that it facilitates or encourages international crimes through its investments.",https://finance.yahoo.com/news/la-caisse-firmly-rejects-allegations-213500501.html?.tsrc=rss,"Thu, 03 Jul 2025 21:35:00 +0000",2025-07-03 17:35:00-04:00,2,2025-07-03 17:35:00-04:00,136.73,136.73,136.73,135.39,133.72,0.0,0.0,0.99,2.25,-0.1,0.81
ABNB,Robinhood Stock Is Falling After S&P 500 Snub. Why That’s Shortsighted.,"Robinhood Markets  had a market valuation of nearly $86.5 billion as of Wednesday’s stock market close.  Shares of  Datadog  soared nearly 15% Thursday morning on the news, while Robinhood’s stock fell about 5%.",https://finance.yahoo.com/m/56803c4f-ee04-3c73-b855-0dafc4737b8b/robinhood-stock-is-falling.html?.tsrc=rss,"Thu, 03 Jul 2025 15:19:00 +0000",2025-07-03 11:19:00-04:00,2,2025-07-03 11:19:00-04:00,136.73,137.18,137.35,134.93,132.5,-0.33,-0.45,1.33,3.19,0.0,0.3
ABNB,Tripadvisor Stock Surges. Why Starboard Stake Is Good for the Travel Sector.,The travel sector has recovered well from the uncertainty caused by President Donald Trump's tariffs agenda.,https://finance.yahoo.com/m/1fb1be02-9e31-3baf-9803-62e126c9da12/tripadvisor-stock-surges.-why.html?.tsrc=rss,"Thu, 03 Jul 2025 13:42:00 +0000",2025-07-03 09:42:00-04:00,3,2025-07-03 09:42:00-04:00,137.35,137.35,137.35,135.8,130.85,0.0,0.0,1.14,4.97,0.7,-0.08
AKAM,5 Insightful Analyst Questions From Akamai’s Q1 Earnings Call,"Akamai’s first quarter results were met with a negative market reaction, despite the company matching Wall Street’s revenue expectations and exceeding analyst forecasts for adjusted earnings. Management attributed the quarter’s performance to continued momentum in its security and compute segments, with both areas growing at double-digit rates and now comprising the majority of Akamai’s revenue. CEO Tom Leighton highlighted strong customer adoption of Guardicore for segmentation and robust deman",https://finance.yahoo.com/news/5-insightful-analyst-questions-akamai-102238537.html?.tsrc=rss,"Mon, 30 Jun 2025 10:22:38 +0000",2025-06-30 06:22:38-04:00,6,2025-06-30 06:22:38-04:00,80.15,80.15,80.15,N/A,78.54,0.0,0.0,N/A,2.05,0.0,0.62
AKAM,Keybanc Initiates Akamai (AKAM) With An Underweight Rating,"Akamai Technologies, Inc. (NASDAQ:AKAM) is one of 12 best cybersecurity stocks to buy now. KeyBanc Capital Markets has initiated coverage of Akamai Technologies, Inc. (NASDAQ:AKAM) with an Underweight rating and a price target of $63, signaling a cautious stance on the cloud and content delivery network provider. In a note to investors, the firm acknowledged that […]",https://finance.yahoo.com/news/keybanc-initiates-akamai-akam-underweight-074044480.html?.tsrc=rss,"Fri, 27 Jun 2025 07:40:44 +0000",2025-06-27 03:40:44-04:00,9,2025-06-27 03:40:44-04:00,79.7,79.7,79.61,79.77,78.32,0.0,0.11,-0.09,1.76,0.0,0.59
ALB,Albemarle (ALB) Stock Drops Despite Market Gains: Important Facts to Note,"In the most recent trading session, Albemarle (ALB) closed at $67.21, indicating a -1.15% shift from the previous trading day.",https://finance.yahoo.com/news/albemarle-alb-stock-drops-despite-215003089.html?.tsrc=rss,"Thu, 03 Jul 2025 21:50:03 +0000",2025-07-03 17:50:03-04:00,2,2025-07-03 17:50:03-04:00,67.16,67.16,67.16,67.98,63.76,0.0,0.0,-1.21,5.33,0.4,0.0
ALB,Albemarle (NYSE:ALB) Price Surges 23% Over Last Month,"Albemarle (NYSE:ALB) has recently been added to multiple Russell indices, significantly boosting its visibility and potentially enhancing trading liquidity. Over the past month, the company's stock price rose by 23%. This movement comes amid strong market conditions, with the S&amp;P 500 and Nasdaq reaching all-time highs following a robust jobs report. While the broader market climbed and Albemarle's visibility increased, its inclusion in the indices could have added weight to the positive...",https://finance.yahoo.com/news/albemarle-nyse-alb-price-surges-171531368.html?.tsrc=rss,"Thu, 03 Jul 2025 17:15:31 +0000",2025-07-03 13:15:31-04:00,2,2025-07-03 13:15:31-04:00,67.16,67.16,67.66,68.14,64.28,0.0,-0.74,-1.44,4.48,0.0,0.88
ALB,This Week In Energy Transition - Wood Mackenzie Boosts Innovation with Leadership Appointment,"Wood Mackenzie, a leading global data and analytics company in the energy transition space, has appointed Bernardo Rodriguez as its new Chief Product & Technology Officer, effective from July 7, 2025. With over 25 years of experience in leading digital transformations and growth initiatives, Rodriguez’s role highlights the company's commitment to investing in advanced product and technological capabilities, including artificial intelligence (AI). His leadership is expected to drive innovation...",https://finance.yahoo.com/news/week-energy-transition-wood-mackenzie-113711024.html?.tsrc=rss,"Thu, 03 Jul 2025 11:37:11 +0000",2025-07-03 07:37:11-04:00,3,2025-07-03 07:37:11-04:00,67.66,67.66,67.66,65.04,63.36,0.0,0.0,4.03,6.79,0.0,0.93
ALGN,Align Technology's Quarterly Earnings Preview: What You Need to Know,"Align Technology is gearing up to release its second-quarter results later this month, and analysts expect a solid double-digit growth in earnings.",https://www.barchart.com/story/news/33190486/align-technology-s-quarterly-earnings-preview-what-you-need-to-know?.tsrc=rss,"Thu, 03 Jul 2025 07:02:35 +0000",2025-07-03 03:02:35-04:00,3,2025-07-03 03:02:35-04:00,199.21,199.21,196.97,194.84,190.02,0.0,1.14,2.24,4.84,0.0,0.49
ALGN,Britt Vitalone Joins Align Technology Board of Directors,"TEMPE, Ariz. & SAN JOSE, Calif. & DALLAS, July 02, 2025--Align Technology, Inc. (""Align"") (Nasdaq: ALGN) a leading global medical device company that designs, manufactures, and sells the Invisalign® System of clear aligners, iTero™ intraoral scanners, and exocad™ CAD/CAM software for digital orthodontics and restorative dentistry, today announced that its Board of Directors has appointed Britt Vitalone, Executive Vice President and Chief Financial Officer (""CFO""), McKesson Corporation, to Align’",https://finance.yahoo.com/news/britt-vitalone-joins-align-technology-203500608.html?.tsrc=rss,"Wed, 02 Jul 2025 20:35:00 +0000",2025-07-02 16:35:00-04:00,3,2025-07-02 16:35:00-04:00,196.97,196.97,195.64,194.26,187.19,0.0,0.68,1.4,5.22,0.0,0.38
ALGN,ALGN vs. SAUHY: Which Stock Is the Better Value Option?,ALGN vs. SAUHY: Which Stock Is the Better Value Option?,https://finance.yahoo.com/news/algn-vs-sauhy-stock-better-154002033.html?.tsrc=rss,"Tue, 01 Jul 2025 15:40:02 +0000",2025-07-01 11:40:02-04:00,4,2025-07-01 11:40:02-04:00,197.13,196.04,191.26,188.37,183.03,0.56,3.07,4.65,7.7,0.5,0.65
ALLE,What to Expect From Allegion's Next Quarterly Earnings Report,"Allegion is anticipated to release its second-quarter results later this month, and analysts predict a single-digit growth in the company’s bottom-line figure.",https://www.barchart.com/story/news/33196562/what-to-expect-from-allegion-s-next-quarterly-earnings-report?.tsrc=rss,"Thu, 03 Jul 2025 12:07:13 +0000",2025-07-03 08:07:13-04:00,3,2025-07-03 08:07:13-04:00,147.55,147.55,147.55,147.21,143.21,0.0,0.0,0.23,3.03,0.0,0.38
ALLE,Allegion Boosts Product Portfolio With the Acquisition of ELATEC,"ALLE strengthens its global electronics portfolio with $379.1M ELATEC buyout, targeting RFID reader and credential solutions growth.",https://finance.yahoo.com/news/allegion-boosts-product-portfolio-acquisition-135400440.html?.tsrc=rss,"Wed, 02 Jul 2025 13:54:00 +0000",2025-07-02 09:54:00-04:00,4,2025-07-02 09:54:00-04:00,147.21,147.21,147.21,145.5,142.59,0.0,0.0,1.18,3.24,0.0,0.74
ALLE,Allegion Finalizes Acquisition of Leading Readers and Credentials Provider ELATEC,"DUBLIN, July 01, 2025--Allegion plc (NYSE: ALLE), a leading global security products and solutions provider, through one of its subsidiaries, has completed the acquisition of ELATEC, including Elatec GmbH and other group entities, (""ELATEC"") from Summit Partners for €330 million on a cash-free, debt-free basis.",https://finance.yahoo.com/news/allegion-finalizes-acquisition-leading-readers-123000118.html?.tsrc=rss,"Tue, 01 Jul 2025 12:30:00 +0000",2025-07-01 08:30:00-04:00,5,2025-07-01 08:30:00-04:00,145.5,145.5,145.5,143.35,143.85,0.0,0.0,1.5,1.15,0.0,0.48
ALL,Allstate Finalizes Group Health Divestiture for $1.25 Bn,"ALL concludes the sale of its Group Health business to Nationwide, netting a roughly $500 million book gain and sharpening focus on core operations.",https://finance.yahoo.com/news/allstate-finalizes-group-health-divestiture-170000494.html?.tsrc=rss,"Wed, 02 Jul 2025 17:00:00 +0000",2025-07-02 13:00:00-04:00,3,2025-07-02 13:00:00-04:00,194.48,193.53,195.29,200.14,191.4,0.49,-0.41,-2.83,1.61,0.0,0.53
LNT,Is Alliant Energy Stock Outperforming the Nasdaq?,"Despite Alliant Energy’s strong performance relative to the broader Nasdaq Composite over the past year, Wall Street analysts remain cautiously optimistic about the stock’s prospects.",https://www.barchart.com/story/news/33023681/is-alliant-energy-stock-outperforming-the-nasdaq?.tsrc=rss,"Tue, 24 Jun 2025 13:38:42 +0000",2025-06-24 09:38:42-04:00,12,2025-06-24 09:38:42-04:00,61.37,61.37,61.37,61.11,60.3,0.0,0.0,0.43,1.77,0.0,0.2
ALLY,Ally Financial Stock Gets Relative Strength Rating Lift,A Relative Strength Rating upgrade for Ally Financial shows improving technical performance. Will it continue?,https://finance.yahoo.com/m/a1cc5fe7-3efc-3ecb-aa8d-7d853027f048/ally-financial-stock-gets.html?.tsrc=rss,"Thu, 03 Jul 2025 18:54:03 +0000",2025-07-03 14:54:03-04:00,2,2025-07-03 14:54:03-04:00,41.12,41.12,41.03,40.76,38.78,0.0,0.22,0.88,6.03,0.0,0.72
ALLY,Will Ally Financial (ALLY) Beat Estimates Again in Its Next Earnings Report?,Ally Financial (ALLY) has an impressive earnings surprise history and currently possesses the right combination of the two key ingredients for a likely beat in its next quarterly report.,https://finance.yahoo.com/news/ally-financial-ally-beat-estimates-161004094.html?.tsrc=rss,"Thu, 03 Jul 2025 16:10:04 +0000",2025-07-03 12:10:04-04:00,2,2025-07-03 12:10:04-04:00,41.12,41.12,41.09,40.56,38.82,0.0,0.07,1.38,5.92,0.0,0.66
AON,Aon (NYSE:AON) Enhances Leadership Team With Strategic Industry Appointments,"Aon (NYSE:AON) recently appointed David Carlson as its global industrial and manufacturing leader, a move that underscores the company's focus on enhancing industry-specific insights and expertise. Despite these significant leadership changes, Aon's stock price remained relatively flat over the past week with a slight 1% decline. This contrasts with broader market trends, as the S&amp;P 500 and Nasdaq experienced gains. Aon's appointment of Carlson, along with other leadership shifts, may have...",https://finance.yahoo.com/news/aon-nyse-aon-enhances-leadership-173153670.html?.tsrc=rss,"Wed, 02 Jul 2025 17:31:53 +0000",2025-07-02 13:31:53-04:00,3,2025-07-02 13:31:53-04:00,351.39,351.42,349.48,358.02,356.89,-0.01,0.55,-1.85,-1.54,0.0,0.2
AON,Canadian defined benefit pension plans show increased funded levels in Q2: Aon,"Aon plc (NYSE: AON), a leading global professional services firm, announced today that the aggregate funded ratio for Canadian pension plans in the S&amp;P/TSX Composite Index increased to 109 percent compared to 105.5 percent at the end of last quarter, according to the Aon Pension Risk Tracker.",https://finance.yahoo.com/news/canadian-defined-benefit-pension-plans-154500244.html?.tsrc=rss,"Wed, 02 Jul 2025 15:45:00 +0000",2025-07-02 11:45:00-04:00,3,2025-07-02 11:45:00-04:00,349.74,347.15,349.48,356.52,356.29,0.75,0.07,-1.9,-1.84,0.0,0.0
AON,Aon's (NYSE:AON) investors will be pleased with their respectable 93% return over the last five years,"While Aon plc ( NYSE:AON ) shareholders are probably generally happy, the stock hasn't had particularly good run...",https://finance.yahoo.com/news/aons-nyse-aon-investors-pleased-110016328.html?.tsrc=rss,"Tue, 01 Jul 2025 11:00:16 +0000",2025-07-01 07:00:16-04:00,5,2025-07-01 07:00:16-04:00,356.09,356.09,356.09,354.63,358.4,0.0,0.0,0.41,-0.64,0.33,0.27
APD,Air Products and Chemicals (NYSE:APD) Removed From Two Russell 1000 Indexes,"Air Products and Chemicals (NYSE: APD) recently experienced a significant development as it was dropped from both the Russell 1000 Defensive Index and the Russell 1000 Value-Defensive Index. This removal from the indices comes amid a broader market rally, with the S&amp;P 500 and Nasdaq hitting new highs. Despite its 4% price move over the last week, which aligns with the market's general upward trajectory of 3.4%, these index changes may add some complexity to the company's investor sentiment...",https://finance.yahoo.com/news/air-products-chemicals-nyse-apd-173202245.html?.tsrc=rss,"Mon, 30 Jun 2025 17:32:02 +0000",2025-06-30 13:32:02-04:00,5,2025-06-30 13:32:02-04:00,282.08,283.21,282.1,N/A,270.37,-0.4,-0.01,N/A,4.33,0.0,0.23
APD,"Air Products to Broadcast Fiscal 2025 Third Quarter Earnings Teleconference on July 31, 2025","Air Products (NYSE:APD) will hold a conference call to discuss its fiscal 2025 third quarter financial results on Thursday, July 31, 2025 at 8:00 a.m. ET. The teleconference will be open to the public and the media in listen-only mode by telephone and Internet broadcast.",https://finance.yahoo.com/news/air-products-broadcast-fiscal-2025-170000453.html?.tsrc=rss,"Mon, 30 Jun 2025 17:00:00 +0000",2025-06-30 13:00:00-04:00,5,2025-06-30 13:00:00-04:00,283.21,282.29,282.1,N/A,268.6,0.33,0.39,N/A,5.44,0.0,0.0
APD,Plug Power Stock Is Surging. Why Hydrogen Just Got a Boost From the Senate Bill.,"The Senate’s latest rewrite of the bill offers tax credits to the industry through to Jan. 1, 2028, two years longer than the previous version.  Shares of  Plug Power  the largest pure-play clean hydrogen company in the U.S., rose 10% in early trading.  Bloom Energy  which makes fuel cells that can run on hydrogen, was up 8.5%.",https://finance.yahoo.com/m/962f9a48-e737-39cf-9b15-b6b34a96cf22/plug-power-stock-is-surging..html?.tsrc=rss,"Mon, 30 Jun 2025 14:00:00 +0000",2025-06-30 10:00:00-04:00,6,2025-06-30 10:00:00-04:00,282.1,282.1,282.1,N/A,271.39,0.0,0.0,N/A,3.95,0.0,0.82
APH,What You Need To Know Ahead of Amphenol's Earnings Release,"Amphenol is forecast to unveil its second-quarter results later this month, with analysts predicting a double-digit earnings growth.",https://www.barchart.com/story/news/33200760/what-you-need-to-know-ahead-of-amphenol-s-earnings-release?.tsrc=rss,"Thu, 03 Jul 2025 14:36:31 +0000",2025-07-03 10:36:31-04:00,2,2025-07-03 10:36:31-04:00,99.29,99.55,99.55,97.82,97.25,-0.26,-0.26,1.5,2.1,0.0,0.38
APH,APH Scales Through Acquisitions: Is the Growth Thesis Strengthening?,"Amphenol builds momentum through targeted acquisitions, reinforcing growth across core sectors.",https://finance.yahoo.com/news/aph-scales-acquisitions-growth-thesis-153600967.html?.tsrc=rss,"Tue, 01 Jul 2025 15:36:00 +0000",2025-07-01 11:36:00-04:00,4,2025-07-01 11:36:00-04:00,97.12,97.11,97.78,98.21,95.72,0.01,-0.67,-1.11,1.46,0.0,0.38
APH,Amphenol (NYSE:APH) Exits Multiple Russell Value Indices In 2025 Index Reconstitution,"Amphenol (NYSE:APH) recently experienced a significant price movement, with its stock appreciating by 49% over the last quarter, a period characterized by its removal from major indices like the Russell 1000 Value Index. Financial results showed a substantial increase in sales and net income, complemented by a dividend declaration and ongoing stock buyback program. These factors likely contributed to the price move, alongside broader market trends such as the S&amp;P 500 and Nasdaq's rise to new...",https://finance.yahoo.com/news/amphenol-nyse-aph-exits-multiple-172348170.html?.tsrc=rss,"Mon, 30 Jun 2025 17:23:48 +0000",2025-06-30 13:23:48-04:00,5,2025-06-30 13:23:48-04:00,98.43,98.26,97.79,N/A,94.77,0.17,0.65,N/A,3.86,0.0,0.89
ADM,Archer Daniels Midland (ADM) Stock Drops Despite Market Gains: Important Facts to Note,"In the closing of the recent trading day, Archer Daniels Midland (ADM) stood at $55.31, denoting a -1.06% move from the preceding trading day.",https://finance.yahoo.com/news/archer-daniels-midland-adm-stock-221502320.html?.tsrc=rss,"Thu, 03 Jul 2025 22:15:02 +0000",2025-07-03 18:15:02-04:00,2,2025-07-03 18:15:02-04:00,55.15,55.15,55.15,55.93,53.17,0.0,0.0,-1.39,3.72,0.4,0.0
ADM,4 Agriculture Operations Stocks Riding Health Trends Amid Margin Woes,"The Agriculture - Operations industry is gaining from healthy eating trends, innovation and global demand, but rising costs and trade risks pose challenges. CTVA, ADM, AVO and ALCO look promising.",https://finance.yahoo.com/news/4-agriculture-operations-stocks-riding-131200965.html?.tsrc=rss,"Thu, 03 Jul 2025 13:12:00 +0000",2025-07-03 09:12:00-04:00,3,2025-07-03 09:12:00-04:00,55.06,55.06,55.06,54.53,52.73,0.0,0.0,0.97,4.42,0.0,0.69
ADM,Bunge completes long-delayed mega-merger with grain handler Viterra,"CHICAGO (Reuters) -Global agribusiness Bunge Global said it officially closed a long-delayed deal to merge with Glencore-backed Viterra on Wednesday, two years after announcing the $34 billion mega-deal.  The merger creates a global crop trading and processing giant that is poised to rival agribusiness giants Archer-Daniels-Midland and Cargill, at a time when slumping grain prices, weak crop-processing margins and geopolitical tensions have eroded profitability in the sector.  Bunge shares closed 1.4% higher on Wednesday.",https://ca.finance.yahoo.com/news/bunge-completes-long-delayed-mega-220824424.html?.tsrc=rss,"Wed, 02 Jul 2025 22:08:24 +0000",2025-07-02 18:08:24-04:00,3,2025-07-02 18:08:24-04:00,55.93,55.93,55.76,54.45,52.35,0.0,0.3,2.72,6.84,0.0,0.2
ADP,Nonfarm Payrolls Exceed Estimates in June,Nonfarm Payrolls Exceed Estimates in June.,https://finance.yahoo.com/news/nonfarm-payrolls-exceed-estimates-june-150300788.html?.tsrc=rss,"Thu, 03 Jul 2025 15:03:00 +0000",2025-07-03 11:03:00-04:00,2,2025-07-03 11:03:00-04:00,308.49,308.05,307.07,302.57,300.98,0.14,0.46,1.96,2.5,0.0,0.0
ADP,Stocks Edge Up Pre-Bell as Investors Await Key Jobs Report Before Independence Day,US equity markets were marginally trending upwards before the opening bell Thursday as traders await,https://finance.yahoo.com/news/stocks-edge-pre-bell-investors-113339933.html?.tsrc=rss,"Thu, 03 Jul 2025 11:33:39 +0000",2025-07-03 07:33:39-04:00,3,2025-07-03 07:33:39-04:00,307.07,307.07,307.07,304.44,297.92,0.0,0.0,0.86,3.07,0.0,0.1
ADP,"Nasdaq, S&P 500 Notch New Record Highs Following US-Vietnam Deal; Tesla Rebounds",The Nasdaq Composite and the S&amp;P 500 jumped to fresh record levels on Wednesday after President Dona,https://finance.yahoo.com/news/nasdaq-p-500-notch-record-205651725.html?.tsrc=rss,"Wed, 02 Jul 2025 20:56:51 +0000",2025-07-02 16:56:51-04:00,3,2025-07-02 16:56:51-04:00,305.04,305.04,303.8,310.13,298.2,0.0,0.41,-1.64,2.29,0.07,0.32
APA,APA Corporation Releases 2025 Sustainability Publications,"HOUSTON, July 01, 2025 (GLOBE NEWSWIRE) -- APA Corporation (Nasdaq: APA) today released its sustainability publications highlighting progress in environmental stewardship, social responsibility and corporate governance throughout 2024. This year, APA simplified its reporting into two complementary documents. Our Approach to Sustainability details the ongoing sustainability programs and initiatives. The 2025 Sustainability Progress Report contains progress on 2024 goals, yearly highlights, key pe",https://finance.yahoo.com/news/apa-corporation-releases-2025-sustainability-225000670.html?.tsrc=rss,"Tue, 01 Jul 2025 22:50:00 +0000",2025-07-01 18:50:00-04:00,4,2025-07-01 18:50:00-04:00,18.94,18.94,19.01,18.27,18.18,0.0,-0.37,3.67,4.18,0.0,0.81
APA,TotalEnergies Expands Suriname Presence With 25% Stake in Block 53,"TTE boosts its Suriname offshore footprint with a 25% stake in Block 53, expanding low-cost GranMorgu development potential.",https://finance.yahoo.com/news/totalenergies-expands-suriname-presence-25-123800876.html?.tsrc=rss,"Tue, 01 Jul 2025 12:38:00 +0000",2025-07-01 08:38:00-04:00,5,2025-07-01 08:38:00-04:00,18.23,18.23,18.23,18.43,18.39,0.0,0.0,-1.09,-0.87,0.0,-0.15
